{
  "pilot_version": "H1-REAL-DATA-PILOT-1.0.0",
  "contract_version": "H1-MEASUREMENT-1.0.0",
  "registry_content_hash": "A3BFDBDD8178E203C63635824985888C76DA10818D64B3E869EC5E30E4A26BB1",
  "registry_freeze_content_hash": "8D973F950CDFB9636CACCB7FE00E0565FB7BECEE2AB043AE1F3224EA8B8B43FB",
  "source_registry_content_hash": "C09C9B152B100D593DD6F5B6FDBA61F81319FD410E79BE086EE33B3459B6738B",
  "pilot_track_ids": ["C02-AZ-H200", "C04-GCP-H200", "P02-SKH-HBM3E", "P04-MU-HBM3E"],
  "created_at": "2026-08-28T04:10:00+09:00",
  "records": [
    {
      "event": {
        "event_id": "EVT-P02-20230821-SAMPLE-EVAL",
        "track_id": "P02-SKH-HBM3E",
        "data_role": "SIGNAL",
        "signal_class": "HBM_SAMPLE",
        "signal_subtype": "CUSTOMER_EVALUATION_UNDERWAY",
        "transmission_layer": "MEMORY_PRODUCT",
        "decision_question": "QUALIFICATION",
        "event_at": "2023-08-21T00:00:00+09:00",
        "published_at": "2023-08-21T00:00:00+09:00",
        "available_at": "2023-08-22T00:00:00+09:00",
        "accessed_at": "2026-08-28T03:30:00+09:00",
        "availability_basis": "PUBLISHER_DATE_FALLBACK",
        "publisher_timezone": "Asia/Seoul",
        "date_precision": "DAY",
        "event_date_precision": "DAY",
        "scope_type": "PRODUCT_GENERATION",
        "scope_value": "SK hynix HBM3E",
        "source_id": "SRC-SKH-20230821-HBM3E-SAMPLE",
        "origin_group": "OG-SKH-20230821-HBM3E-SAMPLE",
        "evidence_level": "B_COMPANY_CLAIM",
        "claim": "SK hynix stated that customer evaluation of HBM3E samples was underway.",
        "excerpt": "a customer’s evaluation of samples is underway ... plans to mass produce HBM3E from the first half of next year",
        "locator": "headline; News Highlights; body paragraphs 1-2",
        "revision_id": "R1",
        "supersedes_event_id": null,
        "right_censored": null,
        "left_truncated": false,
        "review_status": "UNREVIEWED"
      },
      "ingestion_status": "ACCEPTED",
      "candidate_classification_reason": "The wording establishes sample evaluation only; it is not qualification completion or commercialization.",
      "ambiguity": null,
      "human_judgment_required": null
    },
    {
      "event": {
        "event_id": "EVT-P02-20230821-PRODUCTION-PLAN",
        "track_id": "P02-SKH-HBM3E",
        "data_role": "SIGNAL",
        "signal_class": "ORDER_ADJACENT_SUPPLY_COMMITMENT",
        "signal_subtype": "MASS_PRODUCTION_PLANNED",
        "transmission_layer": "QUALIFICATION_COMMERCIAL",
        "decision_question": "TTM",
        "event_at": "2023-08-21T00:00:00+09:00",
        "published_at": "2023-08-21T00:00:00+09:00",
        "available_at": "2023-08-22T00:00:00+09:00",
        "accessed_at": "2026-08-28T03:30:00+09:00",
        "availability_basis": "PUBLISHER_DATE_FALLBACK",
        "publisher_timezone": "Asia/Seoul",
        "date_precision": "DAY",
        "event_date_precision": "DAY",
        "scope_type": "PRODUCT_GENERATION",
        "scope_value": "SK hynix HBM3E",
        "source_id": "SRC-SKH-20230821-HBM3E-SAMPLE",
        "origin_group": "OG-SKH-20230821-HBM3E-SAMPLE",
        "evidence_level": "B_COMPANY_CLAIM",
        "claim": "SK hynix planned HBM3E mass production for the first half of 2024.",
        "excerpt": "a customer’s evaluation of samples is underway ... plans to mass produce HBM3E from the first half of next year",
        "locator": "headline; News Highlights; body paragraphs 1-2",
        "revision_id": "R1",
        "supersedes_event_id": null,
        "right_censored": null,
        "left_truncated": false,
        "review_status": "HOLD"
      },
      "ingestion_status": "HOLD",
      "candidate_classification_reason": "The frozen minimum has no production-plan class; the nearest commitment class would inflate manufacturing intent into an order-adjacent signal.",
      "ambiguity": "A production plan is not a customer order or supply commitment.",
      "human_judgment_required": "Decide whether future versions need a separate production-readiness context class; do not admit this record as a commitment now."
    },
    {
      "event": {
        "event_id": "EVT-P02-20240319-FUTURE-CUSTOMER-SUPPLY",
        "track_id": "P02-SKH-HBM3E",
        "data_role": "OUTCOME",
        "signal_class": "O1_COMMERCIAL_REALIZATION",
        "signal_subtype": "VOLUME_PRODUCTION_FOR_CURRENT_CUSTOMER_SUPPLY",
        "transmission_layer": "COMMERCIAL_REALIZATION",
        "decision_question": "COMMERCIALIZATION_VISIBILITY",
        "event_at": "2024-03-19T00:00:00+09:00",
        "published_at": "2024-03-19T00:00:00+09:00",
        "available_at": "2024-03-20T00:00:00+09:00",
        "accessed_at": "2026-08-28T03:30:00+09:00",
        "availability_basis": "PUBLISHER_DATE_FALLBACK",
        "publisher_timezone": "Asia/Seoul",
        "date_precision": "DAY",
        "event_date_precision": "DAY",
        "scope_type": "PRODUCT_GENERATION",
        "scope_value": "SK hynix HBM3E",
        "source_id": "SRC-SKH-20240319-HBM3E-PRODUCTION",
        "origin_group": "OG-SKH-20240319-HBM3E-PRODUCTION",
        "evidence_level": "B_COMPANY_CLAIM",
        "claim": "Volume production had begun, while customer supply was stated for a later date.",
        "excerpt": "has begun volume production of HBM3E ... for supply to a customer from late March",
        "locator": "News Highlights; body paragraph 1",
        "revision_id": "R1",
        "supersedes_event_id": null,
        "right_censored": null,
        "left_truncated": false,
        "review_status": "HOLD"
      },
      "ingestion_status": "HOLD",
      "candidate_classification_reason": "The disclosure combines observed manufacturing start with future-dated customer supply, so current O1 is not established at publication.",
      "ambiguity": "The exact customer-supply start date and a later confirming disclosure were not observed in this pilot.",
      "human_judgment_required": "Require a contemporaneous source that establishes actual customer supply before approving O1."
    },
    {
      "event": {
        "event_id": "EVT-P04-20230726-SAMPLING",
        "track_id": "P04-MU-HBM3E",
        "data_role": "SIGNAL",
        "signal_class": "HBM_SAMPLE",
        "signal_subtype": "SAMPLING_STARTED",
        "transmission_layer": "MEMORY_PRODUCT",
        "decision_question": "COMMERCIALIZATION_VISIBILITY",
        "event_at": "2023-07-26T00:00:00-06:00",
        "published_at": "2023-07-26T00:00:00-06:00",
        "available_at": "2023-07-27T00:00:00-06:00",
        "accessed_at": "2026-08-28T03:30:00+09:00",
        "availability_basis": "PUBLISHER_DATE_FALLBACK",
        "publisher_timezone": "America/Denver",
        "date_precision": "DAY",
        "event_date_precision": "DAY",
        "scope_type": "PRODUCT_GENERATION",
        "scope_value": "Micron HBM3E",
        "source_id": "SRC-MU-20230726-HBM3E-SAMPLE",
        "origin_group": "OG-MU-20230726-HBM3E-SAMPLE",
        "evidence_level": "A_DIRECT_FACT",
        "claim": "Micron stated that it had begun sampling 8-high 24GB HBM3 Gen2.",
        "excerpt": "has begun sampling the industry’s first 8-high 24GB HBM3 Gen2 memory",
        "locator": "headline; body paragraph 1",
        "revision_id": "R1",
        "supersedes_event_id": null,
        "right_censored": null,
        "left_truncated": false,
        "review_status": "UNREVIEWED"
      },
      "ingestion_status": "ACCEPTED",
      "candidate_classification_reason": "Sampling is an observed issuer action and remains distinct from qualification and customer supply.",
      "ambiguity": null,
      "human_judgment_required": null
    },
    {
      "event": {
        "event_id": "EVT-P04-20230927-QUAL-UNDERWAY",
        "track_id": "P04-MU-HBM3E",
        "data_role": "SIGNAL",
        "signal_class": "QUALIFICATION_STAGE",
        "signal_subtype": "UNDERWAY",
        "transmission_layer": "QUALIFICATION_COMMERCIAL",
        "decision_question": "QUALIFICATION",
        "event_at": "2023-09-27T00:00:00-06:00",
        "published_at": "2023-09-27T00:00:00-06:00",
        "available_at": "2023-09-28T00:00:00-06:00",
        "accessed_at": "2026-08-28T03:30:00+09:00",
        "availability_basis": "PUBLISHER_DATE_FALLBACK",
        "publisher_timezone": "America/Denver",
        "date_precision": "DAY",
        "event_date_precision": "DAY",
        "scope_type": "PRODUCT_GENERATION",
        "scope_value": "Micron HBM3E",
        "source_id": "SRC-MU-20230927-HBM3E-QUAL",
        "origin_group": "OG-MU-FY2023-Q4-PREPARED-REMARKS",
        "evidence_level": "B_COMPANY_CLAIM",
        "claim": "Micron stated that HBM3E qualification for NVIDIA compute products was underway.",
        "excerpt": "Micron HBM3E is currently in qualification for NVIDIA compute products",
        "locator": "FY2023 Q4 prepared remarks, page 3, HBM3E paragraph",
        "revision_id": "R1",
        "supersedes_event_id": null,
        "right_censored": null,
        "left_truncated": false,
        "review_status": "UNREVIEWED"
      },
      "ingestion_status": "ACCEPTED",
      "candidate_classification_reason": "The present-progress wording maps to UNDERWAY and does not establish completion.",
      "ambiguity": null,
      "human_judgment_required": null
    },
    {
      "event": {
        "event_id": "EVT-P04-20231220-QUAL-FINAL",
        "track_id": "P04-MU-HBM3E",
        "data_role": "SIGNAL",
        "signal_class": "QUALIFICATION_STAGE",
        "signal_subtype": "FINAL_STAGE",
        "transmission_layer": "QUALIFICATION_COMMERCIAL",
        "decision_question": "QUALIFICATION",
        "event_at": "2023-12-20T00:00:00-07:00",
        "published_at": "2023-12-20T00:00:00-07:00",
        "available_at": "2023-12-21T00:00:00-07:00",
        "accessed_at": "2026-08-28T03:30:00+09:00",
        "availability_basis": "PUBLISHER_DATE_FALLBACK",
        "publisher_timezone": "America/Denver",
        "date_precision": "DAY",